{
  "$schema": "http://json-schema.org/draft-07/schema#",
  "$id": "gemeinsam-recht/messkorpus/messlauf.schema.json",
  "title": "Messlauf — vollstaendige Trefferliste einer Messdefinition",
  "description": "Ein Lauf haelt jeden einzelnen Treffer der Abfrage dauerhaft fest. Jeder Treffer traegt genau einen Status; ein Ausschluss traegt zwingend einen in der Messdefinition vorher deklarierten Grund. Der Nachweis, dass nichts verloren ging, steht nicht in roh_treffer (das waere zirkulaer), sondern in 'abrufe': je Zeitfenster die von der Quelle gemeldete Trefferzahl samt Relation, die tatsaechlich empfangenen Treffer, die ohne Quelle-ID und die Zahl nach Gerichtsfilter.",
  "type": "object",
  "additionalProperties": false,
  "required": [
    "id",
    "messdefinition",
    "durchgefuehrt_am",
    "datenstand",
    "abrufe",
    "duplikate",
    "roh_treffer",
    "gekappt",
    "treffer"
  ],
  "properties": {
    "id": { "type": "string", "pattern": "^ML-[0-9]{3}$" },
    "messdefinition": {
      "type": "object",
      "additionalProperties": false,
      "required": ["id", "version", "sha256"],
      "properties": {
        "id": { "type": "string", "pattern": "^MD-[0-9]{3}$" },
        "version": { "type": "string", "pattern": "^[0-9]+\\.[0-9]+\\.[0-9]+$" },
        "sha256": { "type": "string", "pattern": "^[0-9a-f]{64}$" }
      }
    },
    "durchgefuehrt_am": { "type": "string", "pattern": "^[0-9]{4}-[0-9]{2}-[0-9]{2}$" },
    "datenstand": { "type": "string", "pattern": "^[0-9]{4}-[0-9]{2}-[0-9]{2}$" },
    "abrufe": {
      "type": "array",
      "minItems": 1,
      "description": "Ein Eintrag je tatsaechlich abgefragtem Zeitfenster. Die Fenster muessen den Zeitraum der Messdefinition lueckenlos und ueberschneidungsfrei abdecken.",
      "items": {
        "type": "object",
        "additionalProperties": false,
        "required": [
          "von",
          "bis",
          "gemeldet_total",
          "gemeldet_relation",
          "empfangen",
          "ohne_id",
          "vor_gerichtsfilter",
          "nach_gerichtsfilter"
        ],
        "properties": {
          "von": { "type": "string", "pattern": "^[0-9]{4}-[0-9]{2}-[0-9]{2}$" },
          "bis": { "type": "string", "pattern": "^[0-9]{4}-[0-9]{2}-[0-9]{2}$" },
          "gemeldet_total": { "type": "integer", "minimum": 0 },
          "gemeldet_relation": {
            "enum": ["eq", "gte", "unbekannt"],
            "description": "Meldet die Quelle die Trefferzahl als exakt (eq) oder nur als Untergrenze (gte)? Alles ausser eq gilt als unvollstaendige Population."
          },
          "empfangen": { "type": "integer", "minimum": 0 },
          "ohne_id": { "type": "integer", "minimum": 0 },
          "vor_gerichtsfilter": { "type": "integer", "minimum": 0 },
          "nach_gerichtsfilter": { "type": "integer", "minimum": 0 }
        }
      }
    },
    "duplikate": {
      "type": "integer",
      "minimum": 0,
      "description": "Treffer, die in mehreren Fenstern erschienen und beim Zusammenfuehren entfernt wurden."
    },
    "roh_treffer": { "type": "integer", "minimum": 0 },
    "gekappt": { "type": "boolean" },
    "treffer": {
      "type": "array",
      "items": {
        "type": "object",
        "additionalProperties": false,
        "required": ["quelle_id", "status", "metadaten_fingerprint"],
        "properties": {
          "quelle_id": { "type": "string", "minLength": 1 },
          "aktenzeichen": { "type": "string" },
          "datum": { "type": "string", "pattern": "^[0-9]{4}-[0-9]{2}-[0-9]{2}$" },
          "gericht": { "type": "string" },
          "link": { "type": "string" },
          "metadaten_fingerprint": {
            "type": "string",
            "pattern": "^[0-9a-f]{64}$",
            "description": "SHA-256 ueber die kanonische Form der hier gespeicherten Quellmetadaten. Aendert die Quelle spaeter ihre Metadaten, wird das sichtbar."
          },
          "status": { "enum": ["eingeschlossen", "ausgeschlossen", "ungeklaert"] },
          "ausschlussgrund": { "type": "string", "pattern": "^[a-z][a-z0-9_]*$" },
          "notiz": { "type": "string" },
          "story_id": { "type": "string", "pattern": "^FS-[0-9]{3}$" },
          "zaehleinheit": {
            "type": "string",
            "minLength": 1,
            "description": "Bezeichner des zugrunde liegenden Rechtsstreits. Mehrere Entscheide desselben Streits teilen ihn und zaehlen zusammen einmal."
          },
          "abschluss_status": {
            "enum": ["abgeschlossen", "rueckweisung_offen", "zwischenentscheid", "ungeklaert"],
            "description": "Ist die gemessene Rechtsfrage endgueltig entschieden? Unabhaengig von der Rechtskraft des Entscheids selbst."
          },
          "erledigungsweg": {
            "type": "object",
            "additionalProperties": false,
            "required": ["modus", "prozessgrund", "beleg"],
            "description": "Auf welchem Weg die Streitigkeit endete — zweiachsig: 'modus' nennt die Form der Erledigung, 'prozessgrund' nur bei prozessualer Erledigung deren Ursache. Strikt getrennt vom 'messausgang': derselbe prozessuale Weg kann zu unterschiedlichen endgueltigen Rechtswirkungen fuehren, deshalb wird gezaehlt wird der Messausgang, nicht der Weg.",
            "properties": {
              "modus": {
                "enum": ["materiell_entschieden", "prozessual_erledigt", "rueckweisung_offen"],
                "description": "rueckweisung_offen: die gemessene Rechtsfrage ist gerade nicht entschieden — dann ist der Messausgang 'offen'."
              },
              "prozessgrund": {
                "oneOf": [
                  {
                    "enum": [
                      "rechtsmittelbegruendung_unzureichend",
                      "aktivlegitimation_fehlte",
                      "klagebewilligung_fehlte_oder_ungueltig",
                      "anfechtungsfrist_verwirkt",
                      "instanzverwirkung",
                      "nichteintreten_sonstiger_grund",
                      "sonstiger_prozessgrund"
                    ]
                  },
                  { "type": "null" }
                ],
                "description": "Nur bei modus='prozessual_erledigt' belegt, sonst ausdruecklich null. Der Schluessel steht immer da, damit ein Fehlen nicht als 'noch nicht kodiert' durchgeht."
              },
              "beleg": { "type": "string", "minLength": 10 },
              "stand_datum": {
                "type": "string",
                "pattern": "^[0-9]{4}-[0-9]{2}-[0-9]{2}$",
                "description": "Datum des Entscheids oder Verfahrensakts, der den hier kodierten Stand begruendet. NICHT dasselbe wie treffer.datum: das ist das Rohmetadatum des urspruenglichen Suchtreffers. Stammt der Endzustand aus einem nach CR-03 E2 zulaessigen verknuepften Folgeentscheid, ist dessen Datum massgeblich. Unter auswertungsmodell='endwirkung' Pflicht fuer eingeschlossene Treffer und nie spaeter als der Datenstand des Laufs; im Modell 'materielle_pruefung' ohne Bedeutung. Gehoert nicht in den Rohmetadaten-Fingerprint."
              },
              "quelle": {
                "type": "string",
                "minLength": 1,
                "description": "Primaerquelle des kodierten Standes: der Roh-Treffer selbst oder ein ausdruecklich verknuepfter Entscheid derselben Verfahrenskette (CR-03 Auflage E2). Unter auswertungsmodell='endwirkung' Pflicht fuer eingeschlossene Treffer; die Laufzeitpruefung lehnt dort zusaetzlich reine Leerzeichen ab."
              }
            }
          },
          "messausgang": {
            "type": "object",
            "additionalProperties": false,
            "required": ["messdefinition_id", "messdefinition_version", "wert", "beleg"],
            "description": "Ausgang bezueglich der gemessenen Norm — nicht der allgemeine Verfahrensausgang der Geschichte.",
            "properties": {
              "messdefinition_id": { "type": "string", "pattern": "^MD-[0-9]{3}$" },
              "messdefinition_version": { "type": "string", "pattern": "^[0-9]+\\.[0-9]+\\.[0-9]+$" },
              "wert": {
                "enum": ["durchgesetzt", "teilweise", "nicht_durchgesetzt", "nicht_anwendbar", "offen"],
                "description": "'offen' ist kein Ergebnis, sondern dessen ausdrueckliches Fehlen: die endgueltige Rechtswirkung steht noch aus. Der Wert zaehlt nie als Erfolg oder Misserfolg und sperrt jede Quote; er ist nur unter auswertungsmodell='endwirkung' definiert."
              },
              "beleg": { "type": "string", "minLength": 10 },
              "quelle": { "type": "string" }
            }
          }
        }
      }
    }
  }
}
