{
  "id": "ML-002",
  "messdefinition": {
    "id": "MD-001",
    "version": "3.0.0",
    "sha256": "576d55c2464cbb4ceef8c8cccd2749ba9c70c78e67a16cf6b5f07c4f075cdc6f"
  },
  "durchgefuehrt_am": "2026-08-10",
  "datenstand": "2026-08-10",
  "abrufe": [
    {
      "von": "2026-01-01",
      "bis": "2026-01-31",
      "gemeldet_total": 18,
      "gemeldet_relation": "eq",
      "empfangen": 18,
      "ohne_id": 0,
      "vor_gerichtsfilter": 18,
      "nach_gerichtsfilter": 1
    },
    {
      "von": "2026-02-01",
      "bis": "2026-02-28",
      "gemeldet_total": 21,
      "gemeldet_relation": "eq",
      "empfangen": 21,
      "ohne_id": 0,
      "vor_gerichtsfilter": 21,
      "nach_gerichtsfilter": 2
    },
    {
      "von": "2026-03-01",
      "bis": "2026-03-31",
      "gemeldet_total": 29,
      "gemeldet_relation": "eq",
      "empfangen": 29,
      "ohne_id": 0,
      "vor_gerichtsfilter": 29,
      "nach_gerichtsfilter": 2
    },
    {
      "von": "2026-04-01",
      "bis": "2026-04-30",
      "gemeldet_total": 17,
      "gemeldet_relation": "eq",
      "empfangen": 17,
      "ohne_id": 0,
      "vor_gerichtsfilter": 17,
      "nach_gerichtsfilter": 1
    },
    {
      "von": "2026-05-01",
      "bis": "2026-05-31",
      "gemeldet_total": 20,
      "gemeldet_relation": "eq",
      "empfangen": 20,
      "ohne_id": 0,
      "vor_gerichtsfilter": 20,
      "nach_gerichtsfilter": 1
    },
    {
      "von": "2026-06-01",
      "bis": "2026-06-30",
      "gemeldet_total": 20,
      "gemeldet_relation": "eq",
      "empfangen": 20,
      "ohne_id": 0,
      "vor_gerichtsfilter": 20,
      "nach_gerichtsfilter": 0
    },
    {
      "von": "2026-07-01",
      "bis": "2026-07-31",
      "gemeldet_total": 5,
      "gemeldet_relation": "eq",
      "empfangen": 5,
      "ohne_id": 0,
      "vor_gerichtsfilter": 5,
      "nach_gerichtsfilter": 0
    }
  ],
  "duplikate": 0,
  "roh_treffer": 7,
  "gekappt": false,
  "treffer": [
    {
      "quelle_id": "CH_BGer_004_4A-162-2026_2026-05-04",
      "aktenzeichen": "4A_162/2026",
      "datum": "2026-05-04",
      "gericht": "CH_BGer_004",
      "link": "https://entscheidsuche.ch/view/CH_BGer_004_4A-162-2026_2026-05-04",
      "metadaten_fingerprint": "98a706947dd710f3175578e9939cf1a99dd69552c951a6b608c8128e60911809",
      "status": "ungeklaert",
      "notiz": "Kodierkonflikt A/B2: Kodierer A bewertet das Einschlussmerkmal \"mietpartei_beruft_sich\" ohne ausdruecklichen Nachweis von Art. 271/271a OR als nicht sicher belegt; Kodierer B2 leitet es aus der Klage auf \"annulation du conge\" ab. Nach Konsensregel bleibt der Treffer ungeklaert. Siehe kodierungsabgleich-A-B2.json."
    },
    {
      "quelle_id": "CH_BGer_004_4A-281-2025_2026-01-20",
      "aktenzeichen": "4A_281/2025",
      "datum": "2026-01-20",
      "gericht": "CH_BGer_004",
      "link": "https://entscheidsuche.ch/view/CH_BGer_004_4A-281-2025_2026-01-20",
      "metadaten_fingerprint": "01c6825b27997dc970d90e842ba036474cae38c49f2c2eb279cbc529dc38d794",
      "status": "eingeschlossen",
      "notiz": "Doppelt bestaetigt durch Kodierer A und B2; siehe kodierungsabgleich-A-B2.json.",
      "zaehleinheit": "4A_281/2025",
      "abschluss_status": "abgeschlossen",
      "erledigungsweg": {
        "modus": "materiell_entschieden",
        "prozessgrund": null,
        "beleg": "Das Bundesgericht prueft die Ruegen nach Art. 271/271a OR materiell und bestaetigt den Kuendigungsgrund als nicht treuwidrig.",
        "stand_datum": "2026-01-20",
        "quelle": "https://entscheidsuche.ch/view/CH_BGer_004_4A-281-2025_2026-01-20"
      },
      "messausgang": {
        "messdefinition_id": "MD-001",
        "messdefinition_version": "3.0.0",
        "wert": "nicht_durchgesetzt",
        "beleg": "E. 4.3/4.4 und Dispositiv: die Anfechtung nach Art. 271/271a OR bleibt erfolglos, die Kuendigung bleibt wirksam.",
        "quelle": "https://entscheidsuche.ch/view/CH_BGer_004_4A-281-2025_2026-01-20"
      }
    },
    {
      "quelle_id": "CH_BGer_004_4A-288-2025_2026-03-13",
      "aktenzeichen": "4A_288/2025",
      "datum": "2026-03-13",
      "gericht": "CH_BGer_004",
      "link": "https://entscheidsuche.ch/view/CH_BGer_004_4A-288-2025_2026-03-13",
      "metadaten_fingerprint": "7ee96a84b87244eca5bded64dde8b3c0e411a8a34a311d7aa379b761fb8a457e",
      "status": "eingeschlossen",
      "notiz": "Doppelt bestaetigt durch Kodierer A und B2; siehe kodierungsabgleich-A-B2.json.",
      "zaehleinheit": "4A_288/2025",
      "abschluss_status": "abgeschlossen",
      "erledigungsweg": {
        "modus": "materiell_entschieden",
        "prozessgrund": null,
        "beleg": "Materielle Behandlung der Rache- und Verkaufskuendigung sowie der Ruegen nach Art. 271/271a OR; der Kuendigungsgrund bleibt bestehen.",
        "stand_datum": "2026-03-13",
        "quelle": "https://entscheidsuche.ch/view/CH_BGer_004_4A-288-2025_2026-03-13"
      },
      "messausgang": {
        "messdefinition_id": "MD-001",
        "messdefinition_version": "3.0.0",
        "wert": "nicht_durchgesetzt",
        "beleg": "E. 3.2/3.3 und Dispositiv: die Kuendigung bleibt endgueltig wirksam.",
        "quelle": "https://entscheidsuche.ch/view/CH_BGer_004_4A-288-2025_2026-03-13"
      }
    },
    {
      "quelle_id": "CH_BGer_004_4A-442-2025_2026-02-20",
      "aktenzeichen": "4A_442/2025",
      "datum": "2026-02-20",
      "gericht": "CH_BGer_004",
      "link": "https://entscheidsuche.ch/view/CH_BGer_004_4A-442-2025_2026-02-20",
      "metadaten_fingerprint": "5997934bf0fc3ec38ecae84d29cc8c2226095c4ab0f41af150e043bec3f4ed2d",
      "status": "ungeklaert",
      "notiz": "Status von A und B2 uebereinstimmend ungeklaert. Die Detailbegruendungen unterscheiden sich teilweise; insbesondere bleibt die Zuordnung zu einem zulaessigen MD-001-v3-Messausgang nicht sicher. Kein zaehlbarer Wert. Siehe kodierungsabgleich-A-B2.json."
    },
    {
      "quelle_id": "CH_BGer_004_4A-493-2025_2026-02-24",
      "aktenzeichen": "4A_493/2025",
      "datum": "2026-02-24",
      "gericht": "CH_BGer_004",
      "link": "https://entscheidsuche.ch/view/CH_BGer_004_4A-493-2025_2026-02-24",
      "metadaten_fingerprint": "4528422146777e98ecce50cc5324850452aab113ab9cdf7ea92211acd9e91691",
      "status": "ausgeschlossen",
      "notiz": "Doppelt bestaetigt ausgeschlossen: Gegenstand ist Mietzinsherabsetzung bzw. Abschreibung; Art. 271a OR erscheint nur im Zusammenhang mit einer moeglichen zukuenftigen Kuendigungssperrfrist. Keine konkrete Kuendigungsanfechtung. Siehe kodierungsabgleich-A-B2.json.",
      "ausschlussgrund": "andere_rechtsfrage"
    },
    {
      "quelle_id": "CH_BGer_004_4A-561-2025_2026-04-27",
      "aktenzeichen": "4A_561/2025",
      "datum": "2026-04-27",
      "gericht": "CH_BGer_004",
      "link": "https://entscheidsuche.ch/view/CH_BGer_004_4A-561-2025_2026-04-27",
      "metadaten_fingerprint": "64cd58990113188c1fdbf6c2691483621b6de5c1d047d799476fdadf3aa31a26",
      "status": "ungeklaert",
      "notiz": "Kodierkonflikt A/B2: A ordnet den bundesgerichtlich entschiedenen Teil der ausserordentlichen Kuendigung nach Art. 257f/266a OR zu und sieht die ordentliche Kuendigung nicht als vom entschiedenen Teil erfasst; B2 wertet den Reformentscheid als endgueltige Erledigung auch der parallel angefochtenen ordentlichen Kuendigung nach Art. 271a OR. Nach Konsensregel bleibt der Treffer ungeklaert. Siehe kodierungsabgleich-A-B2.json."
    },
    {
      "quelle_id": "CH_BGer_004_4A-624-2025_2026-03-23",
      "aktenzeichen": "4A_624/2025",
      "datum": "2026-03-23",
      "gericht": "CH_BGer_004",
      "link": "https://entscheidsuche.ch/view/CH_BGer_004_4A-624-2025_2026-03-23",
      "metadaten_fingerprint": "ec2a513ccd58cf440533073741922652576d20a007e1f63a174e576b4662bd92",
      "status": "eingeschlossen",
      "notiz": "Doppelt bestaetigt durch Kodierer A und B2; siehe kodierungsabgleich-A-B2.json.",
      "zaehleinheit": "4A_624/2025",
      "abschluss_status": "abgeschlossen",
      "erledigungsweg": {
        "modus": "materiell_entschieden",
        "prozessgrund": null,
        "beleg": "Materielle Pruefung von Art. 271 Abs. 1 und Art. 271a Abs. 1 lit. a OR; der festgestellte Konflikt als Kuendigungsgrund macht die Kuendigung nicht missbraeuchlich.",
        "stand_datum": "2026-03-23",
        "quelle": "https://entscheidsuche.ch/view/CH_BGer_004_4A-624-2025_2026-03-23"
      },
      "messausgang": {
        "messdefinition_id": "MD-001",
        "messdefinition_version": "3.0.0",
        "wert": "nicht_durchgesetzt",
        "beleg": "E. 4/5 und Dispositiv: die Kuendigung bleibt gueltig, die Beschwerde wird abgewiesen.",
        "quelle": "https://entscheidsuche.ch/view/CH_BGer_004_4A-624-2025_2026-03-23"
      }
    }
  ]
}
